[
  {
    "id": "polinomio-de-taylor",
    "titulo": "Polinômio de Taylor",
    "descricao": "Explore a aproximação de funções por polinômios de Taylor e veja como o grau do polinômio afeta a precisão.",
    "categoria": "calculo",
    "nivel": "superior",
    "iframeSrc": "https://www.geogebra.org/material/iframe/id/yyj7VkSM/width/900/height/600/border/888888/smb/false/stb/false/stbh/false/ai/true/asb/false/sri/true/rc/false/ld/false/sdz/true/ctl/false",
    "thumbnailUrl": null,
    "autorOriginal": "Luis Claudio LA",
    "urlOriginal": "https://www.geogebra.org/m/yyj7VkSM",
    "licenca": "CC BY-SA",
    "destaque": false,
    "tags": [
      "taylor",
      "polinômio",
      "cálculo",
      "aproximação",
      "série"
    ]
  },
  {
    "id": "trigonometria-triangulo-retangulo-01",
    "titulo": "Trigonometria no Triângulo Retângulo 01",
    "descricao": "Entenda as relações trigonométricas básicas de seno, cosseno e tangente diretamente no triângulo retângulo.",
    "categoria": "trigonometria",
    "nivel": "medio",
    "iframeSrc": "https://www.geogebra.org/material/iframe/id/nm3S3mDy/width/900/height/600/border/888888/smb/false/stb/false/stbh/false/ai/true/asb/false/sri/true/rc/false/ld/false/sdz/true/ctl/false",
    "thumbnailUrl": null,
    "autorOriginal": "Luis Claudio LA",
    "urlOriginal": "https://www.geogebra.org/m/nm3S3mDy",
    "licenca": "CC BY-SA",
    "destaque": false,
    "tags": [
      "trigonometria",
      "triângulo",
      "seno",
      "cosseno",
      "tangente"
    ]
  },
  {
    "id": "trigonometria-triangulo-retangulo-02",
    "titulo": "Trigonometria no Triângulo Retângulo 02",
    "descricao": "Explore a aplicação das razões trigonométricas e resolva problemas no triângulo retângulo de forma dinâmica.",
    "categoria": "trigonometria",
    "nivel": "medio",
    "iframeSrc": "https://www.geogebra.org/material/iframe/id/VcA9kyPV/width/900/height/600/border/888888/smb/false/stb/false/stbh/false/ai/true/asb/false/sri/true/rc/false/ld/false/sdz/true/ctl/false",
    "thumbnailUrl": null,
    "autorOriginal": "Luis Claudio LA",
    "urlOriginal": "https://www.geogebra.org/m/VcA9kyPV",
    "licenca": "CC BY-SA",
    "destaque": false,
    "tags": [
      "trigonometria",
      "triângulo",
      "seno",
      "cosseno",
      "tangente"
    ]
  },
  {
    "id": "trigonometria-triangulo-retangulo-03",
    "titulo": "Trigonometria no Triângulo Retângulo 03",
    "descricao": "Aprofunde seus estudos sobre as relações trigonométricas no triângulo retângulo com esta simulação interativa.",
    "categoria": "trigonometria",
    "nivel": "medio",
    "iframeSrc": "https://www.geogebra.org/material/iframe/id/FuCKyZmY/width/900/height/600/border/888888/smb/false/stb/false/stbh/false/ai/true/asb/false/sri/true/rc/false/ld/false/sdz/true/ctl/false",
    "thumbnailUrl": null,
    "autorOriginal": "Luis Claudio LA",
    "urlOriginal": "https://www.geogebra.org/m/FuCKyZmY",
    "licenca": "CC BY-SA",
    "destaque": false,
    "tags": [
      "trigonometria",
      "triângulo",
      "seno",
      "cosseno",
      "tangente"
    ]
  },
  {
    "id": "trigonometria-triangulo-retangulo-04",
    "titulo": "A Trigonometria no Triângulo Retângulo 04",
    "descricao": "Exercite e compreenda de forma visual a definição de seno, cosseno e tangente no triângulo retângulo.",
    "categoria": "trigonometria",
    "nivel": "medio",
    "iframeSrc": "https://www.geogebra.org/material/iframe/id/kcJhvj6s/width/900/height/600/border/888888/smb/false/stb/false/stbh/false/ai/true/asb/false/sri/true/rc/false/ld/false/sdz/true/ctl/false",
    "thumbnailUrl": null,
    "autorOriginal": "Luis Claudio LA",
    "urlOriginal": "https://www.geogebra.org/m/kcJhvj6s",
    "licenca": "CC BY-SA",
    "destaque": false,
    "tags": [
      "trigonometria",
      "triângulo",
      "seno",
      "cosseno",
      "tangente"
    ]
  },
  {
    "id": "ciclo-trigonometrico-01",
    "titulo": "Ciclo Trigonométrico 01",
    "descricao": "Explore o ciclo trigonométrico e compreenda o comportamento dos arcos e das funções circulares básicas.",
    "categoria": "trigonometria",
    "nivel": "medio",
    "iframeSrc": "https://www.geogebra.org/material/iframe/id/JKM59MEm/width/900/height/600/border/888888/smb/false/stb/false/stbh/false/ai/true/asb/false/sri/true/rc/false/ld/false/sdz/true/ctl/false",
    "thumbnailUrl": null,
    "autorOriginal": "Luis Claudio LA",
    "urlOriginal": "https://www.geogebra.org/m/JKM59MEm",
    "licenca": "CC BY-SA",
    "destaque": false,
    "tags": [
      "ciclo",
      "trigonometria",
      "seno",
      "cosseno",
      "círculo"
    ]
  },
  {
    "id": "ciclo-trigonometrico-02",
    "titulo": "Ciclo Trigonométrico 02",
    "descricao": "Analise as variações de sinais e valores de seno e cosseno à medida que o ângulo percorre o ciclo trigonométrico.",
    "categoria": "trigonometria",
    "nivel": "medio",
    "iframeSrc": "https://www.geogebra.org/material/iframe/id/zHXTjvWF/width/900/height/600/border/888888/smb/false/stb/false/stbh/false/ai/true/asb/false/sri/true/rc/false/ld/false/sdz/true/ctl/false",
    "thumbnailUrl": null,
    "autorOriginal": "Luis Claudio LA",
    "urlOriginal": "https://www.geogebra.org/m/zHXTjvWF",
    "licenca": "CC BY-SA",
    "destaque": false,
    "tags": [
      "ciclo",
      "trigonometria",
      "seno",
      "cosseno",
      "círculo"
    ]
  },
  {
    "id": "funcao-seno-ciclo-trigonometrico",
    "titulo": "Função Seno a partir do Ciclo Trigonométrico",
    "descricao": "Visualize a construção dinâmica do gráfico da função seno à medida que o ponto se move ao redor do ciclo trigonométrico.",
    "categoria": "funcoes",
    "nivel": "medio",
    "iframeSrc": "https://www.geogebra.org/material/iframe/id/WtpbjNmZ/width/900/height/600/border/888888/smb/false/stb/false/stbh/false/ai/true/asb/false/sri/true/rc/false/ld/false/sdz/true/ctl/false",
    "thumbnailUrl": null,
    "autorOriginal": "Luis Claudio LA",
    "urlOriginal": "https://www.geogebra.org/m/WtpbjNmZ",
    "licenca": "CC BY-SA",
    "destaque": false,
    "tags": [
      "função",
      "seno",
      "ciclo",
      "trigonometria",
      "gráfico"
    ]
  },
  {
    "id": "funcao-cosseno-ciclo-trigonometrico",
    "titulo": "Função Cosseno a partir do Ciclo Trigonométrico",
    "descricao": "Visualize a construção dinâmica do gráfico da função cosseno a partir do movimento no ciclo trigonométrico.",
    "categoria": "funcoes",
    "nivel": "medio",
    "iframeSrc": "https://www.geogebra.org/material/iframe/id/RuE2Sw8D/width/900/height/600/border/888888/smb/false/stb/false/stbh/false/ai/true/asb/false/sri/true/rc/false/ld/false/sdz/true/ctl/false",
    "thumbnailUrl": null,
    "autorOriginal": "Luis Claudio LA",
    "urlOriginal": "https://www.geogebra.org/m/RuE2Sw8D",
    "licenca": "CC BY-SA",
    "destaque": false,
    "tags": [
      "função",
      "cosseno",
      "ciclo",
      "trigonometria",
      "gráfico"
    ]
  },
  {
    "id": "razao-aurea-em-construcao",
    "titulo": "Razão Áurea em Construção",
    "descricao": "Explore a beleza e as propriedades geométricas da proporção áurea através desta construção interativa.",
    "categoria": "geometria-plana",
    "nivel": "medio",
    "iframeSrc": "https://www.geogebra.org/material/iframe/id/QHeKK9D2/width/900/height/600/border/888888/smb/false/stb/false/stbh/false/ai/true/asb/false/sri/true/rc/false/ld/false/sdz/true/ctl/false",
    "thumbnailUrl": null,
    "autorOriginal": "Luis Claudio LA",
    "urlOriginal": "https://www.geogebra.org/m/QHeKK9D2",
    "licenca": "CC BY-SA",
    "destaque": false,
    "tags": [
      "proporção",
      "áurea",
      "geometria",
      "retângulo",
      "espiral"
    ]
  },
  {
    "id": "solidos-integracao-integrais-triplas",
    "titulo": "Sólidos de Integração para Integrais Triplas",
    "descricao": "Visualize tridimensionalmente os sólidos de integração e compreenda melhor os limites de integração de integrais triplas.",
    "categoria": "calculo",
    "nivel": "superior",
    "iframeSrc": "https://www.geogebra.org/material/iframe/id/pHBHSPT8/width/900/height/600/border/888888/smb/false/stb/false/stbh/false/ai/true/asb/false/sri/true/rc/false/ld/false/sdz/true/ctl/false",
    "thumbnailUrl": null,
    "autorOriginal": "Luis Claudio LA",
    "urlOriginal": "https://www.geogebra.org/m/pHBHSPT8",
    "licenca": "CC BY-SA",
    "destaque": false,
    "tags": [
      "sólidos",
      "integração",
      "cálculo",
      "integral tripla",
      "3d"
    ]
  },
  {
    "id": "equacao-segundo-grau-passo-a-passo",
    "titulo": "Equação do Segundo Grau Passo a Passo",
    "descricao": "Acompanhe a resolução detalhada passo a passo de equações do segundo grau utilizando a fórmula de Bhaskara.",
    "categoria": "algebra",
    "nivel": "fundamental",
    "iframeSrc": "https://www.geogebra.org/material/iframe/id/KxQCx6Xr/width/900/height/600/border/888888/smb/false/stb/false/stbh/false/ai/true/asb/false/sri/true/rc/false/ld/false/sdz/true/ctl/false",
    "thumbnailUrl": null,
    "autorOriginal": "Luis Claudio LA",
    "urlOriginal": "https://www.geogebra.org/m/KxQCx6Xr",
    "licenca": "CC BY-SA",
    "destaque": false,
    "tags": [
      "equação",
      "2º grau",
      "álgebra",
      "bhaskara",
      "passo a passo"
    ]
  },
  {
    "id": "solido-revolucao-cascas-cilindricas",
    "titulo": "Sólido de Revolução - Cascas Cilíndricas",
    "descricao": "Entenda o cálculo de volumes de sólidos de revolução usando o método das cascas cilíndricas de forma visual e dinâmica.",
    "categoria": "calculo",
    "nivel": "superior",
    "iframeSrc": "https://www.geogebra.org/material/iframe/id/UTgDGkWp/width/900/height/600/border/888888/smb/false/stb/false/stbh/false/ai/true/asb/false/sri/true/rc/false/ld/false/sdz/true/ctl/false",
    "thumbnailUrl": null,
    "autorOriginal": "Luis Claudio LA",
    "urlOriginal": "https://www.geogebra.org/m/UTgDGkWp",
    "licenca": "CC BY-SA",